{
  "$schema": "https://json-schema.org/draft/2020-12/schema",
  "schema_ref": {
    "kind": "SCHEMA",
    "id": "urn:moirae:accord-02r5r3:schema:rule-registry",
    "version": "0.2"
  },
  "$id": "urn:moirae:accord-02r5r3:rule-registry:0.2",
  "object_id": "urn:moirae:accord-02r5r3:rule-registry",
  "object_version": "0.2",
  "provenance": {
    "source_revision": "E4R5R2",
    "source_commit": "44d0e7240c97dcc12463b5611a7adf61399924d7",
    "source_tree": "19dc9356784d08d04945f8e2ce9b24bcd49e3683",
    "source_rule_registry_semantic_sha256": "5a772a45538af7ea3df082050842e1881601d626fc239a549c2a5538a3ca9c86",
    "required_rule_ids": [
      "ORC-001",
      "ORC-002",
      "ORC-003",
      "ARM-001",
      "ARM-002",
      "ARM-003",
      "ARM-004",
      "ARM-005",
      "ARM-006",
      "ARM-007",
      "RAW-001",
      "RAW-002",
      "RAW-003",
      "PROJ-001",
      "PROJ-002",
      "PROJ-003",
      "PROJ-004",
      "LIN-001",
      "LIN-002",
      "LIN-003",
      "LIN-004",
      "LIN-005",
      "LIN-006",
      "LIN-007",
      "LIN-008",
      "PROP-001",
      "PROP-002",
      "PROP-003",
      "PROP-004",
      "PROP-005",
      "SCORE-001",
      "SCORE-002",
      "SCORE-003",
      "BND-001",
      "BND-002",
      "BND-003",
      "BND-004",
      "BND-005",
      "RUN-001",
      "RUN-002",
      "RUN-003",
      "RUN-004",
      "EXT-001",
      "EXT-002",
      "EXT-003",
      "EXT-004",
      "EXT-005",
      "EXT-006",
      "SRC-001",
      "SRC-002",
      "SRC-003",
      "SRC-004",
      "VIS-001",
      "NORM-001",
      "NORM-002",
      "NORM-003",
      "NORM-004",
      "NORM-005",
      "CLF-001",
      "CLF-002",
      "CLF-003",
      "CLF-004",
      "PRED-001",
      "PRED-002",
      "PRED-003",
      "PRED-004",
      "DIGEST-001",
      "DIGEST-002",
      "DIGEST-003",
      "LIN-009",
      "PROP-006",
      "PKG-001",
      "PKG-002",
      "PROF-001",
      "PROF-002",
      "SCHEMA-001",
      "SCHEMA-002",
      "ROLE-001",
      "DIGEST-CANON-001",
      "DIGEST-CANON-002",
      "DIGEST-CANON-003",
      "SCENARIO-ID-001",
      "E4R1-PRED-001",
      "E4R1-PRED-002",
      "E4R1-PRED-003",
      "E4R1-AUTH-001",
      "E4R1-BIND-001",
      "E4R1-PROP-001",
      "E4R1-PART-001",
      "E4R1-PART-002",
      "E4R1-PART-003",
      "E4R1-NEG-001",
      "E4R1-NEG-002",
      "E4R1-ENT-001",
      "E4R1-CANON-001",
      "E4R1-EXPECT-001",
      "E4R1-CLOSE-001",
      "E4R2-REF-001",
      "E4R2-CANON-001",
      "E4R2-BIND-001",
      "E4R2-NEG-001",
      "E4R2-GRAPH-001",
      "E4R2-PROFILE-001",
      "E4R2-CLOSE-001"
    ],
    "required_rule_inventory_hash": "c169da14bc2dcf844d3b86cd33bced11e869c20084461efd57c1ecb6e354e506"
  },
  "rules": [
    {
      "rule_id": "ORC-001",
      "declared_class": "DEFERRED_NO_SUBJECT_ARTIFACT",
      "inherited_family": "ORACLE_BOUNDARY",
      "inherited_failure_code": "ACCORD-02R2-ORACLE-REFERENCE",
      "provenance_source_revision": "E4R5R2",
      "provenance_source_commit": "44d0e7240c97dcc12463b5611a7adf61399924d7",
      "missing_subject_roles": [
        "public scenario catalog",
        "system-under-test input manifests"
      ],
      "later_lifecycle_stage": "EXPERIMENT_ASSEMBLY",
      "deferred_reason": "The package defines the contract but contains no concrete lifecycle subject artifact; inventing bytes would be non-conformant."
    },
    {
      "rule_id": "ORC-002",
      "declared_class": "DEFERRED_NO_SUBJECT_ARTIFACT",
      "inherited_family": "ORACLE_BOUNDARY",
      "inherited_failure_code": "ACCORD-02R2-ORACLE-REVERSE-JOIN",
      "provenance_source_revision": "E4R5R2",
      "provenance_source_commit": "44d0e7240c97dcc12463b5611a7adf61399924d7",
      "missing_subject_roles": [
        "scorer configuration",
        "public scenario catalog",
        "arm manifests"
      ],
      "later_lifecycle_stage": "EXPERIMENT_ASSEMBLY",
      "deferred_reason": "The package defines the contract but contains no concrete lifecycle subject artifact; inventing bytes would be non-conformant."
    },
    {
      "rule_id": "ORC-003",
      "declared_class": "DEFERRED_NO_SUBJECT_ARTIFACT",
      "inherited_family": "ORACLE_BOUNDARY",
      "inherited_failure_code": "ACCORD-02R2-OPAQUE-SCENARIO-ID",
      "provenance_source_revision": "E4R5R2",
      "provenance_source_commit": "44d0e7240c97dcc12463b5611a7adf61399924d7",
      "missing_subject_roles": [
        "scenario_id",
        "fixture identity",
        "timing configuration"
      ],
      "later_lifecycle_stage": "EXPERIMENT_ASSEMBLY",
      "deferred_reason": "The package defines the contract but contains no concrete lifecycle subject artifact; inventing bytes would be non-conformant."
    },
    {
      "rule_id": "ARM-001",
      "declared_class": "DEFERRED_NO_SUBJECT_ARTIFACT",
      "inherited_family": "ARM_ISOLATION",
      "inherited_failure_code": "ACCORD-02R2-ARM-DISCRIMINATOR",
      "provenance_source_revision": "E4R5R2",
      "provenance_source_commit": "44d0e7240c97dcc12463b5611a7adf61399924d7",
      "missing_subject_roles": [
        "arm input manifest"
      ],
      "later_lifecycle_stage": "EXPERIMENT_INPUT_ASSEMBLY",
      "deferred_reason": "The package defines the contract but contains no concrete lifecycle subject artifact; inventing bytes would be non-conformant."
    },
    {
      "rule_id": "ARM-002",
      "declared_class": "DEFERRED_NO_SUBJECT_ARTIFACT",
      "inherited_family": "ARM_ISOLATION",
      "inherited_failure_code": "ACCORD-02R2-ARM-PROFILE-MISMATCH",
      "provenance_source_revision": "E4R5R2",
      "provenance_source_commit": "44d0e7240c97dcc12463b5611a7adf61399924d7",
      "missing_subject_roles": [
        "arm_id",
        "input_profile_id",
        "arm input profile catalog"
      ],
      "later_lifecycle_stage": "EXPERIMENT_INPUT_ASSEMBLY",
      "deferred_reason": "The package defines the contract but contains no concrete lifecycle subject artifact; inventing bytes would be non-conformant."
    },
    {
      "rule_id": "ARM-003",
      "declared_class": "DEFERRED_NO_SUBJECT_ARTIFACT",
      "inherited_family": "ARM_ISOLATION",
      "inherited_failure_code": "ACCORD-02R2-SOURCE-TYPE-NOT-ALLOWED",
      "provenance_source_revision": "E4R5R2",
      "provenance_source_commit": "44d0e7240c97dcc12463b5611a7adf61399924d7",
      "missing_subject_roles": [
        "arm source references",
        "arm input profile"
      ],
      "later_lifecycle_stage": "EXPERIMENT_INPUT_ASSEMBLY",
      "deferred_reason": "The package defines the contract but contains no concrete lifecycle subject artifact; inventing bytes would be non-conformant."
    },
    {
      "rule_id": "ARM-004",
      "declared_class": "DEFERRED_NO_SUBJECT_ARTIFACT",
      "inherited_family": "ARM_ISOLATION",
      "inherited_failure_code": "ACCORD-02R2-SOURCE-RECORD-MISMATCH",
      "provenance_source_revision": "E4R5R2",
      "provenance_source_commit": "44d0e7240c97dcc12463b5611a7adf61399924d7",
      "missing_subject_roles": [
        "source_type",
        "source_record_ref.record_type"
      ],
      "later_lifecycle_stage": "EXPERIMENT_INPUT_ASSEMBLY",
      "deferred_reason": "The package defines the contract but contains no concrete lifecycle subject artifact; inventing bytes would be non-conformant."
    },
    {
      "rule_id": "ARM-005",
      "declared_class": "DEFERRED_NO_SUBJECT_ARTIFACT",
      "inherited_family": "ARM_ISOLATION",
      "inherited_failure_code": "ACCORD-02R2-ARM-EXTENSION-SMUGGLING",
      "provenance_source_revision": "E4R5R2",
      "provenance_source_commit": "44d0e7240c97dcc12463b5611a7adf61399924d7",
      "missing_subject_roles": [
        "arm input manifest extensions",
        "source projections"
      ],
      "later_lifecycle_stage": "EXPERIMENT_INPUT_ASSEMBLY",
      "deferred_reason": "The package defines the contract but contains no concrete lifecycle subject artifact; inventing bytes would be non-conformant."
    },
    {
      "rule_id": "ARM-006",
      "declared_class": "DEFERRED_NO_SUBJECT_ARTIFACT",
      "inherited_family": "ARM_ISOLATION",
      "inherited_failure_code": "ACCORD-02R2-CLASSIFIER-SOURCE-LEAK",
      "provenance_source_revision": "E4R5R2",
      "provenance_source_commit": "44d0e7240c97dcc12463b5611a7adf61399924d7",
      "missing_subject_roles": [
        "ARM-C classifier feature references",
        "ARM-B-visible source set"
      ],
      "later_lifecycle_stage": "EXPERIMENT_INPUT_ASSEMBLY",
      "deferred_reason": "The package defines the contract but contains no concrete lifecycle subject artifact; inventing bytes would be non-conformant."
    },
    {
      "rule_id": "ARM-007",
      "declared_class": "DEFERRED_NO_SUBJECT_ARTIFACT",
      "inherited_family": "ARM_ISOLATION",
      "inherited_failure_code": "ACCORD-02R2-EXTENSION-SEMANTIC-LEAK",
      "provenance_source_revision": "E4R5R2",
      "provenance_source_commit": "44d0e7240c97dcc12463b5611a7adf61399924d7",
      "missing_subject_roles": [
        "arm-visible portable record extensions",
        "active record/evidence profile"
      ],
      "later_lifecycle_stage": "EXPERIMENT_INPUT_ASSEMBLY",
      "deferred_reason": "The package defines the contract but contains no concrete lifecycle subject artifact; inventing bytes would be non-conformant."
    },
    {
      "rule_id": "RAW-001",
      "declared_class": "DEFERRED_NO_SUBJECT_ARTIFACT",
      "inherited_family": "RAW_OUTPUT",
      "inherited_failure_code": "ACCORD-02R2-RAW-ENVELOPE",
      "provenance_source_revision": "E4R5R2",
      "provenance_source_commit": "44d0e7240c97dcc12463b5611a7adf61399924d7",
      "missing_subject_roles": [
        "raw arm output"
      ],
      "later_lifecycle_stage": "PROVIDER_EXECUTION_CAPTURE",
      "deferred_reason": "The package defines the contract but contains no concrete lifecycle subject artifact; inventing bytes would be non-conformant."
    },
    {
      "rule_id": "RAW-002",